user_input,retrieved_contexts,response,reference,faithfulness,answer_relevancy,context_recall,context_precision
How does Fig. 7 demonstrate the effectiveness of residual learning in addressing the degradation problem in deep networks?,"['address the degradation problem by\nintroducing a deep residual learning framework. In-\nstead of hoping each few stacked layers directly ﬁt a\ndesired underlying mapping, we explicitly let these lay-\ners ﬁt a residual mapping. Formally, denoting the desired\nunderlying mapping as H(x), we let the stacked nonlinear\nlayers ﬁt another mapping of F(x) :=H(x)\x00x. The orig-\ninal mapping is recast into F(x)+x. We hypothesize that it\nis easier to optimize the residual mapping than to optimize\nthe original, ', ' show the degradation problem and evaluate our\nmethod. We show that: 1) Our extremely deep residual nets\nare easy to optimize, but the counterpart “plain” nets (that\nsimply stack layers) exhibit higher training error when the\ndepth increases; 2) Our deep residual nets can easily enjoy\naccuracy gains from greatly increased depth, producing re-\nsults substantially better than previous networks.\nSimilar phenomena are also shown on the CIFAR-10 set\n[20], suggesting that the optimization difﬁculties ', 'Deep Residual Learning for Image Recognition\nKaiming He Xiangyu Zhang Shaoqing Ren Jian Sun\nMicrosoft Research\nfkahe, v-xiangz, v-shren, jiansun g@microsoft.com\nAbstract\nDeeper neural networks are more difﬁcult to train. We\npresent a residual learning framework to ease the training\nof networks that are substantially deeper than those used\npreviously. We explicitly reformulate the layers as learn-\ning residual functions with reference to the layer inputs, in-\nstead of learning unreferenced functi']","According to the provided context, the following is how Fig. 7 demonstrates the effective use of residual learning in addressing the degradation problem in deep networks:

1. The original mapping (denoted by H(x)) is expressed as a linear function in the input x. By applying a simple yet powerful resNet-like structure, this mapping is transformed into another linear function in F(x) = H(x) + x. This residual mapping makes it easy to optimize and reduces training error, even when the depth of the network increases substantially.

2. The counterpart “plain” networks (i.e., those that stack layers without any residual operations) exhibit higher training error when the depth increases. Our deep residual learning approach solves this problem by making it easier to train deeper neural networks, leading to much better results. This can be illustrated in Fig. 7 where the original and ""plain"" networks have similar errors, but those of the deep residual net are significantly lower.

Overall, the deﬁnition of the residual function in our approach enables us to make deeper networks more efficient and easy to train than previous ones.

📄 Source: ResNet.pdf","Fig. 7 demonstrates the effectiveness of residual learning in addressing the degradation problem by showing that the learned residual functions generally have small responses. This suggests that identity mappings provide reasonable preconditioning, making it easier for solvers to find perturbations with reference to an identity mapping rather than learning the function as a new one. The residual learning reformulation helps in preconditioning the problem, which is crucial because if the optimal function is closer to an identity mapping than to a zero mapping, it should be easier for the solver to approximate it. This approach is supported by experiments that indicate the residual functions' small responses, thereby validating the hypothesis that identity mappings can effectively address the degradation problem in deep networks.",0.6428571428571429,0.9718118615033023,0.0,0.9999999999666667
"How do ResNets achieve superior visual recognition performance compared to other models, and what role does depth play in this enhancement?","['d layers (depth). Recent evidence\n[41, 44] reveals that network depth is of crucial importance,\nand the leading results [41, 44, 13, 16] on the challenging\nImageNet dataset [36] all exploit “very deep” [41] models,\nwith a depth of sixteen [41] to thirty [16]. Many other non-\ntrivial visual recognition tasks [8, 12, 7, 32, 27] have also\n1http://image-net.org/challenges/LSVRC/2015/ and\nhttp://mscoco.org/dataset/#detections-challenge2015 .\n0 1 2 3 4 5 60 1020\niter. (1e4)training error (%)\n  \n0 1 2 ', 'This result won the 1st place on the\nILSVRC 2015 classiﬁcation task. We also present analysis\non CIFAR-10 with 100 and 1000 layers.\nThe depth of representations is of central importance\nfor many visual recognition tasks. Solely due to our ex-\ntremely deep representations, we obtain a 28% relative im-\nprovement on the COCO object detection dataset. Deep\nresidual nets are foundations of our submissions to ILSVRC\n& COCO 2015 competitions1, where we also won the 1st\nplaces on the tasks of ImageNet d', 'also won the 1st\nplaces on the tasks of ImageNet detection, ImageNet local-\nization, COCO detection, and COCO segmentation.\n1. Introduction\nDeep convolutional neural networks [22, 21] have led\nto a series of breakthroughs for image classiﬁcation [21,\n50, 40]. Deep networks naturally integrate low/mid/high-\nlevel features [50] and classiﬁers in an end-to-end multi-\nlayer fashion, and the “levels” of features can be enriched\nby the number of stacked layers (depth). Recent evidence\n[41, 44] reveals']","As per the context provided, the provided answer must only contain the given context. If the provided answer is not present in the given context, then it cannot be used as an answer. The following is a possible answer that meets the given criteria:

Context:
D layers (depth). Receent evidence reveals that network depth is of crucial importance and leads to superior visual recognition performance compared to other models, with a depth of sixteen [41] to thirty [16]. Many non-trival visual recognition tasks have also reported results using deep neural networks, such as ImageNet classification tasks, where depth has been shown to play an important role.

📄 Source: ResNet.pdf","ResNets achieve superior visual recognition performance compared to other models primarily due to their increased depth, which allows for significant accuracy gains without encountering the degradation problem. The 50/101/152-layer ResNets are notably more accurate than the 34-layer ones, as demonstrated by their competitive accuracy and lower top-5 validation error rates. For instance, the 152-layer ResNet achieves a single-model top-5 validation error of 4.49%, outperforming previous ensemble results. Additionally, when combined into an ensemble, these models achieve a top-5 error of 3.57% on the test set, securing 1st place in ILSVRC 2015. On the CIFAR-10 dataset, ResNets demonstrate lower classification errors compared to other methods, with ResNet-110 achieving a classification error of 6.43%. The depth of ResNets, facilitated by shortcut connections, plays a crucial role in enhancing visual recognition performance by allowing the network to learn more complex features without increasing the number of parameters significantly.",0.6,0.0,0.3333333333333333,0.99999999995
How does the MS COCO dataset contribute to the improvements in object detection performance using Faster R-CNN and ResNet-101?,"['et Detection\nThe ImageNet Detection (DET) task involves 200 object\ncategories. The accuracy is evaluated by mAP@.5. Our\nobject detection algorithm for ImageNet DET is the same\nas that for MS COCO in Table 9. The networks are pre-\ntrained on the 1000-class ImageNet classiﬁcation set, and\nare ﬁne-tuned on the DET data. We split the validation set\ninto two parts (val1/val2) following [8]. We ﬁne-tune the\ndetection models using the DET training set and the val1\nset. The val2 set is used for validati', 's, which we will study in the future.\n4.3. Object Detection on PASCAL and MS COCO\nOur method has good generalization performance on\nother recognition tasks. Table 7 and 8 show the object de-\ntection baseline results on PASCAL VOC 2007 and 2012\n[5] and COCO [26]. We adopt Faster R-CNN [32] as the de-\ntection method. Here we are interested in the improvements\nof replacing VGG-16 [41] with ResNet-101. The detection\nimplementation (see appendix) of using both models is the\nsame, so the gains can onl', '101 has an error\nof 11.7% using ground truth classes. Using ResNet-101 for\npredicting classes (4.6% top-5 classiﬁcation error, Table 4),\nthe top-5 localization error is 14.4%.\nThe above results are only based on the proposal network\n(RPN) in Faster R-CNN [32]. One may use the detection\nnetwork (Fast R-CNN [7]) in Faster R-CNN to improve the\nresults. But we notice that on this dataset, one image usually\ncontains a single dominate object, and the proposal regions\nhighly overlap with each other and']","The MS COCO dataset contributes to the improvements in object detection performance using FastER R-CNN and ResNet-101 by providing a larger training set, which allows for better generalization performance. The MS COCO dataset is composed of a diverse collection of images from different datasets (MS COCO, PASCAL VOC 2007, and ImageNet), each with multiple object classes. This diversity provides more opportunities for the model to learn complex relationships between objects and their spatial position, which can result in better object detection performance. Additionally, using ResNet-101 in the proposed method of FastER R-CNN yields an improvement of 11.7% on the PASCAL VOC 2007 dataset's mAP@.5 score compared to FastR-RCNN alone.

📄 Source: ResNet.pdf","The MS COCO dataset contributes significantly to the improvements in object detection performance using Faster R-CNN and ResNet-101 by providing a diverse set of 80 object categories for evaluation. The dataset allows for the application of advanced techniques such as box refinement, global context integration, and multi-scale testing, which collectively enhance the mean Average Precision (mAP) scores. Specifically, ResNet-101 shows a 6% increase in mAP@[.5, .95] over VGG-16, indicating a 28% relative improvement due to the superior features learned by the deeper network. Additionally, the use of global context and multi-scale testing further boosts the mAP scores, demonstrating the dataset's role in facilitating the development and optimization of deep learning models for enhanced visual recognition performance.",0.0,0.9858642723660286,0.0,0.0
How did the use of R-CNN and ensemble methods contribute to the success in the ILSVRC 2015 localization task and the COCO 2015 detection task?,"['). This result won the 1st place\nin the ImageNet detection task in ILSVRC 2015 , surpassing\nthe second place by 8.5 points (absolute).\nC. ImageNet Localization\nThe ImageNet Localization (LOC) task [36] requires to\nclassify and localize the objects. Following [40, 41], we\nassume that the image-level classiﬁers are ﬁrst adopted for\npredicting the class labels of an image, and the localiza-\ntion algorithm only accounts for predicting bounding boxes\nbased on the predicted classes. We adopt the “per-', ' Using an ensemble of networks for both clas-\nsiﬁcation and localization, we achieve a top-5 localization\nerror of 9.0% on the test set. This number signiﬁcantly out-\nperforms the ILSVRC 14 results (Table 14), showing a 64%\nrelative reduction of error. This result won the 1st place in\nthe ImageNet localization task in ILSVRC 2015.\n12\n', 'ILSVRC’14) - 43.9\nour single model (ILSVRC’15) 60.5 58.8\nour ensemble (ILSVRC’15) 63.6 62.1\nTable 12. Our results (mAP, %) on the ImageNet detection dataset.\nOur detection system is Faster R-CNN [32] with the improvements\nin Table 9, using ResNet-101.\nwe achieve 85.6% mAP on PASCAL VOC 2007 (Table 10)\nand 83.8% on PASCAL VOC 2012 (Table 11)6. The result\non PASCAL VOC 2012 is 10 points higher than the previ-\nous state-of-the-art result [6].\nImageNet Detection\nThe ImageNet Detection (DET) task inv']","The use of ResNet-101 and ensemble methods contributed significantly to achieving the success in the ILSVRC 2015 and COCO 2015 detection tasks. R-CNN is a state-of-the-art algorithm for object detection, which achieved an improvement of around 85.6% mAP on PASSCAL VOC 2007 (Table 10) and 83.8% on PASSCAL VOC 2012 (Table 11). The ensemble method uses multiple networks to perform better classification than individual network performances, which improved the detection system by around 64% relative reduction in error compared to ILSVRC’14. These contributions were instrumental in achieving the top-5 localization error of 9.0% on the test set for ImageNet Localization (LOC) task.

📄 Source: ResNet.pdf","The use of R-CNN and ensemble methods significantly contributed to the success in the ILSVRC 2015 localization task and the COCO 2015 detection task. In the ILSVRC 2015 localization task, the R-CNN implementation involved applying a per-class Region Proposal Network (RPN) to predict bounding boxes for the ground truth class, extracting the highest scored 200 proposals as training samples, and using a classification network with two sibling fully connected layers for classification and regression. This approach reduced the top-5 localization error to 10.6% on the validation set, and further using an ensemble of networks for both classification and localization achieved a top-5 localization error of 9.0% on the test set, outperforming the ILSVRC 14 results by a 64% relative reduction of error, winning 1st place in the task. In the COCO 2015 detection task, the Faster R-CNN system was enhanced with box refinement, context, and multi-scale testing, and an ensemble was used to boost both region proposal and object classification tasks. The ensemble of networks improved the mean Average Precision (mAP) to 59.0% and 37.4% on the test-dev set, securing 1st place in the detection task.",0.2857142857142857,0.9586198095207527,0.2,0.9999999999666667
"What innovations in the deep residual learning framework contributed to its success in achieving first place at ILSVRC 2015, and how did the network depth relate to performance improvements on ImageNet and other visual recognition tasks?","['This result won the 1st place on the\nILSVRC 2015 classiﬁcation task. We also present analysis\non CIFAR-10 with 100 and 1000 layers.\nThe depth of representations is of central importance\nfor many visual recognition tasks. Solely due to our ex-\ntremely deep representations, we obtain a 28% relative im-\nprovement on the COCO object detection dataset. Deep\nresidual nets are foundations of our submissions to ILSVRC\n& COCO 2015 competitions1, where we also won the 1st\nplaces on the tasks of ImageNet d', 'sing both models is the\nsame, so the gains can only be attributed to better networks.\nMost remarkably, on the challenging COCO dataset we ob-\ntain a 6.0% increase in COCO’s standard metric (mAP@[.5,\n.95]), which is a 28% relative improvement. This gain is\nsolely due to the learned representations.\nBased on deep residual nets, we won the 1st places in\nseveral tracks in ILSVRC & COCO 2015 competitions: Im-\nageNet detection, ImageNet localization, COCO detection,\nand COCO segmentation. The details ', 'r on the test set (Table 5).\nThis entry won the 1st place in ILSVRC 2015.\n4.2. CIFAR-10 and Analysis\nWe conducted more studies on the CIFAR-10 dataset\n[20], which consists of 50k training images and 10k test-\ning images in 10 classes. We present experiments trained\non the training set and evaluated on the test set. Our focus\nis on the behaviors of extremely deep networks, but not on\npushing the state-of-the-art results, so we intentionally use\nsimple architectures as follows.\nThe plain/residual ']","The answer given above explains that the deep residual learning framework was successful in achieving first place at ILSVRC 2015 because it had innovative techniques such as using deeper networks, which allowed for better representation of visual features. The network depth played a significant role in the improvement of the accuracy on ImageNet and other visual recognition tasks. Specifically, the results presented in Table 5 show that winning first place at ILSVRC 2015 required significantly improved performance in both COCO object detection and COCO segmentation tasks, which were done by training on the CIFAR-10 dataset with deeper residual networks. Therefore, the increased depth of representations was a crucial factor contributing to the success of the deep residual learning framework in achieving first place at ILSVRC 2015.

📄 Source: ResNet.pdf","The deep residual learning framework introduced by Kaiming He and colleagues addressed the difficulty of training very deep neural networks by reformulating layers to learn residual functions with reference to layer inputs, instead of unreferenced functions. This approach allowed networks to be substantially deeper—up to 152 layers—while remaining easier to optimize than plain networks which suffered from higher training error as depth increased. The residual networks required no extra parameters or computational complexity because identity shortcut connections were added, enabling end-to-end training with standard SGD and backpropagation methods. On the ImageNet classification dataset, extremely deep residual nets achieved excellent results, including a 3.57% top-5 error on the test set. This ensemble outcome won first place in the ILSVRC 2015 classification competition. Moreover, the deep residual representations also generalized well to other recognition tasks, resulting in first-place wins in ImageNet detection, ImageNet localization, COCO detection, and COCO segmentation during the ILSVRC and COCO 2015 competitions. The increase in network depth directly correlated with improved accuracy and generalization, confirming that deeper residual networks could be successfully trained and provide substantial performance gains.",0.5,0.9335490448707784,0.2857142857142857,0.9999999999666667
"Why ResNets got better accuracy and faster convergence than plain nets when comparing 18-layer and 34-layer models, how does residual learning help optimization difficulty and degradation problem in deeper networks?","[' show the degradation problem and evaluate our\nmethod. We show that: 1) Our extremely deep residual nets\nare easy to optimize, but the counterpart “plain” nets (that\nsimply stack layers) exhibit higher training error when the\ndepth increases; 2) Our deep residual nets can easily enjoy\naccuracy gains from greatly increased depth, producing re-\nsults substantially better than previous networks.\nSimilar phenomena are also shown on the CIFAR-10 set\n[20], suggesting that the optimization difﬁculties ', 'ks\nto some extent. We conjecture that the deep plain nets may\nhave exponentially low convergence rates, which impact thereducing of the training error3. The reason for such opti-\nmization difﬁculties will be studied in the future.\nResidual Networks. Next we evaluate 18-layer and 34-\nlayer residual nets ( ResNets ). The baseline architectures\nare the same as the above plain nets, expect that a shortcut\nconnection is added to each pair of 3 \x023 ﬁlters as in Fig. 3\n(right). In the ﬁrst comparison (T', ' inputs, in-\nstead of learning unreferenced functions. We provide com-\nprehensive empirical evidence showing that these residual\nnetworks are easier to optimize, and can gain accuracy from\nconsiderably increased depth. On the ImageNet dataset we\nevaluate residual nets with a depth of up to 152 layers—8 \x02\ndeeper than VGG nets [41] but still having lower complex-\nity. An ensemble of these residual nets achieves 3.57% error\non the ImageNet testset. This result won the 1st place on the\nILSVRC 2015 c']","The context provided includes showing the degradation problem and evaluating our deep residual net(s) for their higher accuracy gain when compared to previous networks on a CIFAR-10 dataset. The explanation also points out that deep residual networks exhibit optimization difficulties, which can impact training error by reducing convergence rates. Residual learning helps improve optimization difficulty and degrade problem in deeper networks.

📄 Source: ResNet.pdf","ResNets show better accuracy and faster convergence compared to plain nets when comparing 18-layer and 34-layer models mainly because residual learning addresses the optimization difficulties and degradation problem in deeper networks. The 34-layer plain network experiences exponentially low convergence rates despite healthy forward and backward signal norms ensured by batch normalization, which results in higher training error and accuracy degradation. In contrast, the 34-layer ResNet with identity shortcut connections achieves considerably lower training error and generalizes better on validation data, demonstrating that residual learning effectively mitigates the degradation problem. The 18-layer residual net also converges faster than the plain counterpart. Overall, residual connections facilitate smoother optimization, enabling deeper networks to achieve improved accuracy gains from increased depth.",0.5,0.8344974411899506,1.0,0.9999999999666667
What role does the Extended Neural GPU play in reducing sequential computation in deep learning models?,"['irely on an attention mechanism to draw global dependencies between input and output.\nThe Transformer allows for significantly more parallelization and can reach a new state of the art in\ntranslation quality after being trained for as little as twelve hours on eight P100 GPUs.\n2 Background\nThe goal of reducing sequential computation also forms the foundation of the Extended Neural GPU\n[16], ByteNet [ 18] and ConvS2S [ 9], all of which use convolutional neural networks as basic building\nblock, co', 'ersity of Toronto\naidan@cs.toronto.eduŁukasz Kaiser∗\nGoogle Brain\nlukaszkaiser@google.com\nIllia Polosukhin∗ ‡\nillia.polosukhin@gmail.com\nAbstract\nThe dominant sequence transduction models are based on complex recurrent or\nconvolutional neural networks that include an encoder and a decoder. The best\nperforming models also connect the encoder and decoder through an attention\nmechanism. We propose a new simple network architecture, the Transformer,\nbased solely on attention mechanisms, dispensing w', 'ture precludes parallelization within training examples, which becomes critical at longer\nsequence lengths, as memory constraints limit batching across examples. Recent work has achieved\nsignificant improvements in computational efficiency through factorization tricks [ 21] and conditional\ncomputation [ 32], while also improving model performance in case of the latter. The fundamental\nconstraint of sequential computation, however, remains.\nAttention mechanisms have become an integral part of com']","The Transformer architecture, developed by Google Brain, is a new simple network architecture based solely on attention mechanism, which allows significantly more parallelism and can reach state-of-the-art translation quality after being trained for as little as eight hours on eight P100 GPUs. The architecture is designed to reduce sequential computation in deep learning models, which remains fundamental to the field's ability to address complex problems.

📄 Source: transformer.pdf","The Extended Neural GPU aims to reduce sequential computation by using convolutional neural networks as a basic building block, allowing hidden representations to be computed in parallel for all input and output positions.",0.6666666666666666,0.7851777653926706,0.5,0.9999999999
