user_input,retrieved_contexts,response,reference,faithfulness,answer_relevancy,context_recall,context_precision
"Why deep convolutional neural networks, hard to train?","['also won the 1st\nplaces on the tasks of ImageNet detection, ImageNet local-\nization, COCO detection, and COCO segmentation.\n1. Introduction\nDeep convolutional neural networks [22, 21] have led\nto a series of breakthroughs for image classiﬁcation [21,\n50, 40]. Deep networks naturally integrate low/mid/high-\nlevel features [50] and classiﬁers in an end-to-end multi-\nlayer fashion, and the “levels” of features can be enriched\nby the number of stacked layers (depth). Recent evidence\n[41, 44] reveals', 'd\nabove. Our method shows no optimization difﬁculty , and\nthis103-layer network is able to achieve training error\n<0.1% (Fig. 6, right). Its test error is still fairly good\n(7.93%, Table 6).\nBut there are still open problems on such aggressively\ndeep models. The testing result of this 1202-layer network\nis worse than that of our 110-layer network, although bothtraining data 07+12 07++12\ntest data VOC 07 test VOC 12 test\nVGG-16 73.2 70.4\nResNet-101 76.4 73.8\nTable 7. Object detection mAP (%) on t', 'an. Very deep convolutional networks\nfor large-scale image recognition. In ICLR , 2015.\n[42] R. K. Srivastava, K. Greff, and J. Schmidhuber. Highway networks.\narXiv:1505.00387 , 2015.\n[43] R. K. Srivastava, K. Greff, and J. Schmidhuber. Training very deep\nnetworks. 1507.06228 , 2015.\n[44] C. Szegedy, W. Liu, Y . Jia, P. Sermanet, S. Reed, D. Anguelov, D. Er-\nhan, V . Vanhoucke, and A. Rabinovich. Going deeper with convolu-\ntions. In CVPR , 2015.\n[45] R. Szeliski. Fast surface interpolation using']","To answer the question, ""Why deep convuluctional neural networks are difficult to train,"" we can provide two reasons:

1. The number of parameters required by these networks is relatively high compared to traditional neural networks. To achieve a certain level of accuracy for an image recognition task or other deep learning-based task, researchers must use many more parameters than in traditional models with smaller input and output dimensions. This increases the computational complexity associated with training.

2. The model's capacity is also constrained by the size of its input data. These models require much more data to train effectively than traditional models that can fit onto a single CPU or GPU, making it difficult for them to learn from the limited data available during the training process. This results in suboptimal performance in some cases.

In summary, deep convoluctional neural networks are challenging to train because they require more parameters and data than traditional models, which can become computationally intensive. The model's capacity to fit onto smaller datasets also presents additional limitations that may not be present in simpler models.

📄 Source: ResNet.pdf","Deep convolutional neural networks have enabled breakthroughs in image classification by integrating features at multiple levels through many stacked layers. However, increasing the network depth introduces challenges. One major issue is the problem of vanishing/exploding gradients, which hampers convergence during training. Although techniques like normalized initialization and intermediate normalization layers help networks with many layers begin converging, a degradation problem arises: as depth increases, accuracy saturates and then degrades, which is not due to overfitting but because deeper models tend to have higher training error. This suggests that deeper networks are harder to optimize, and current solvers cannot easily find solutions better than shallower counterparts, making training deep convolutional neural networks difficult.",0.0,0.9592177128177432,0.4,0.0
How does normalized initialization help address the problem of vanishing and exploding gradients in training very deep convolutional neural networks?,"['\nnormalization (BN) [16] right after each convolution and\nbefore activation, following [16]. We initialize the weights\nas in [13] and train all plain/residual nets from scratch. We\nuse SGD with a mini-batch size of 256. The learning rate\nstarts from 0.1 and is divided by 10 when the error plateaus,\nand the models are trained for up to 60\x02104iterations. We\nuse a weight decay of 0.0001 and a momentum of 0.9. We\ndo not use dropout [14], following the practice in [16].\nIn testing, for comparison stu', 'es: Is\nlearning better networks as easy as stacking more layers?\nAn obstacle to answering this question was the notorious\nproblem of vanishing/exploding gradients [1, 9], which\nhamper convergence from the beginning. This problem,\nhowever, has been largely addressed by normalized initial-\nization [23, 9, 37, 13] and intermediate normalization layers\n[16], which enable networks with tens of layers to start con-\nverging for stochastic gradient descent (SGD) with back-\npropagation [22].\nWhen deeper ', 'at this optimization difﬁculty is unlikely to\nbe caused by vanishing gradients. These plain networks are\ntrained with BN [16], which ensures forward propagated\nsignals to have non-zero variances. We also verify that the\nbackward propagated gradients exhibit healthy norms with\nBN. So neither forward nor backward signals vanish. In\nfact, the 34-layer plain net is still able to achieve compet-\nitive accuracy (Table 3), suggesting that the solver works\nto some extent. We conjecture that the deep pla']","Yes, normalized initialization (BN) in plain/residual net training with a weight decay of 0.0001 and a momentum of 0.9 does indeed help address the problem of vanishing and exploding gradient in deep convoluctional neural networks. The method of BN has been widely accepted as a method to combat these problems by ensuring that the weights are not only large but also have normalized variances. By ensuring that the weights exhibit healthy norms, BN prevents vanishing and exploding gradients from attacking the network during training, resulting in better convergence and improved generalization performance. The results of training the 34-layer plain net with BN are also noteworthy, suggesting that this method works to some extent to combat the problems associated with deep neural networks.

📄 Source: ResNet.pdf","Normalized initialization helps address the notorious problem of vanishing and exploding gradients, which hamper convergence at the start of training very deep convolutional neural networks. By properly normalizing the initial weights, it enables networks with tens of layers to begin converging when trained with stochastic gradient descent and back-propagation, thereby overcoming a key obstacle to optimizing very deep models.",0.25,0.9802008442117324,1.0,0.9999999999666667
What role did Microsoft Research play in advancing deep residual learning for image recognition?,"['dence shows that\nthe residual learning principle is generic, and we expect that\nit is applicable in other vision and non-vision problems.\n2. Related Work\nResidual Representations. In image recognition, VLAD\n[18] is a representation that encodes by the residual vectors\nwith respect to a dictionary, and Fisher Vector [30] can be\nformulated as a probabilistic version [18] of VLAD. Both\nof them are powerful shallow representations for image re-\ntrieval and classiﬁcation [4, 48]. For vector quantizat', 'This result won the 1st place on the\nILSVRC 2015 classiﬁcation task. We also present analysis\non CIFAR-10 with 100 and 1000 layers.\nThe depth of representations is of central importance\nfor many visual recognition tasks. Solely due to our ex-\ntremely deep representations, we obtain a 28% relative im-\nprovement on the COCO object detection dataset. Deep\nresidual nets are foundations of our submissions to ILSVRC\n& COCO 2015 competitions1, where we also won the 1st\nplaces on the tasks of ImageNet d', ' complexity than VGG\nnets [41]. Our ensemble has 3.57% top-5 error on theImageNet testset, and won the 1st place in the ILSVRC\n2015 classiﬁcation competition . The extremely deep rep-\nresentations also have excellent generalization performance\non other recognition tasks, and lead us to further win the\n1st places on: ImageNet detection, ImageNet localization,\nCOCO detection, and COCO segmentation in ILSVRC &\nCOCO 2015 competitions. This strong evidence shows that\nthe residual learning principle i']","The context provided does not include any information on the role played by Microsoft Research in advancing deep residual learning for image recognition. The given passage only states that the ""extremely deep representation"" won a 1st place in the ILSVRC 2015 competition and has excellent generalization performance, suggesting its potential utility for other recognition tasks as well. Therefore, there is no mention of specific contributions made by Microsoft Research in advancing this approach.

📄 Source: ResNet.pdf","Microsoft Research developed the residual learning framework that facilitates the training of extremely deep neural networks for image recognition. Their work demonstrated that residual networks could be substantially deeper than previous models, such as VGG nets, while being easier to optimize and achieving better accuracy. The team from Microsoft Research evaluated residual networks with depths up to 152 layers, achieving a 3.57% top-5 error on the ImageNet test set and winning first place in the ILSVRC 2015 classification task. Additionally, their extremely deep residual networks led to significant improvements on other tasks, including ImageNet detection, localization, COCO detection, and segmentation, establishing the residual learning principle as a generic approach applicable to various vision problems.",1.0,0.0,1.0,0.5833333333041666
Why Kaiming He residual nets better for train deep model and results in more good performance on image recognition and object detection?,"['This result won the 1st place on the\nILSVRC 2015 classiﬁcation task. We also present analysis\non CIFAR-10 with 100 and 1000 layers.\nThe depth of representations is of central importance\nfor many visual recognition tasks. Solely due to our ex-\ntremely deep representations, we obtain a 28% relative im-\nprovement on the COCO object detection dataset. Deep\nresidual nets are foundations of our submissions to ILSVRC\n& COCO 2015 competitions1, where we also won the 1st\nplaces on the tasks of ImageNet d', ' show the degradation problem and evaluate our\nmethod. We show that: 1) Our extremely deep residual nets\nare easy to optimize, but the counterpart “plain” nets (that\nsimply stack layers) exhibit higher training error when the\ndepth increases; 2) Our deep residual nets can easily enjoy\naccuracy gains from greatly increased depth, producing re-\nsults substantially better than previous networks.\nSimilar phenomena are also shown on the CIFAR-10 set\n[20], suggesting that the optimization difﬁculties ', 'sing both models is the\nsame, so the gains can only be attributed to better networks.\nMost remarkably, on the challenging COCO dataset we ob-\ntain a 6.0% increase in COCO’s standard metric (mAP@[.5,\n.95]), which is a 28% relative improvement. This gain is\nsolely due to the learned representations.\nBased on deep residual nets, we won the 1st places in\nseveral tracks in ILSVRC & COCO 2015 competitions: Im-\nageNet detection, ImageNet localization, COCO detection,\nand COCO segmentation. The details ']","The provided context explains that the AI assistant is an academic AI, i.e., it is a subject matter expert in its field of study. However, since it is not specifically designed to answer questions or provide advice, the question ""Why are Kaiminh He residual net models better for training deep models and achieving good performance on image recognition and object detection?"" cannot be answered with specific information. The provided context provides general information about the AI assistant's capabilities and techniques used in these fields, but not any detailed explanations on why Kaiminh He is preferred over other options or techniques for training deep models and achieving good performance on these tasks.

📄 Source: ResNet.pdf","Kaiming He and colleagues present a residual learning framework that reformulates layers as learning residual functions with reference to layer inputs instead of unreferenced functions, which makes training extremely deep neural networks easier. Their deep residual nets are easier to optimize and gain accuracy from greatly increased depth, outperforming plain nets that exhibit higher training errors with increased depth. On the ImageNet dataset, their 152-layer residual net is much deeper than previous networks yet has lower complexity than VGG nets, achieving 3.57% top-5 error and winning 1st place in the ILSVRC 2015 classification task. Furthermore, these deep residual nets deliver a 28% relative improvement on the COCO object detection dataset and have strong generalization to other recognition tasks, leading to 1st place wins in detection, localization, and segmentation at ILSVRC and COCO 2015 competitions.",0.2857142857142857,0.0,0.5,0.9999999999666667
How does hierarchical basis preconditioning improve the convergence speed of solvers for Partial Differential Equations?,"['ternative to Multigrid is hierarchical basis pre-\nconditioning [45, 46], which relies on variables that repre-\nsent residual vectors between two scales. It has been shown\n[3, 45, 46] that these solvers converge much faster than stan-\ndard solvers that are unaware of the residual nature of the\nsolutions. These methods suggest that a good reformulation\nor preconditioning can simplify the optimization.\nShortcut Connections. Practices and theories that lead to\nshortcut connections [2, 34, 49] have b', '[45] R. Szeliski. Fast surface interpolation using hierarchical basis func-\ntions. TPAMI , 1990.\n[46] R. Szeliski. Locally adapted hierarchical basis preconditioning. In\nSIGGRAPH , 2006.\n[47] T. Vatanen, T. Raiko, H. Valpola, and Y . LeCun. Pushing stochas-\ntic gradient towards second-order methods–backpropagation learn-\ning with transformations in nonlinearities. In Neural Information\nProcessing , 2013.\n[48] A. Vedaldi and B. Fulkerson. VLFeat: An open and portable library\nof computer vision al', 'al and classiﬁcation [4, 48]. For vector quantization,\nencoding residual vectors [17] is shown to be more effec-\ntive than encoding original vectors.\nIn low-level vision and computer graphics, for solv-\ning Partial Differential Equations (PDEs), the widely used\nMultigrid method [3] reformulates the system as subprob-\nlems at multiple scales, where each subproblem is respon-\nsible for the residual solution between a coarser and a ﬁner\nscale. An alternative to Multigrid is hierarchical basis pre-\n']","According to the provided context, Hierarchical basis preconditioning (HBP) has been shown to lead to shortcut connections in the optimization process. This means that a good reformulation or preconditioning can simplify the optimization and lead to faster convergence speed for Partiall Differential Equations (PDEs). By using HBP, practitioners and theories can lead to shortcut connections which are effective in solving PDEs with local adaptive hierarchical basis functions.

📄 Source: ResNet.pdf",Hierarchical basis preconditioning improves the convergence speed of solvers for Partial Differential Equations by relying on variables that represent residual vectors between two scales. It has been shown that these solvers converge much faster than standard solvers that are unaware of the residual nature of the solutions.,0.2,0.9274961843880986,1.0,0.8333333332916666
What multi-layer perceptrons do?,"[' has two or\nthree layers (Fig. 5), while more layers are possible. But if\nFhas only a single layer, Eqn.(1) is similar to a linear layer:\ny=W1x+x, for which we have not observed advantages.\nWe also note that although the above notations are about\nfully-connected layers for simplicity, they are applicable to\nconvolutional layers. The function F(x;fWig)can repre-\nsent multiple convolutional layers. The element-wise addi-\ntion is performed on two feature maps, channel by channel.\n3.3. Network Archi', 'at lead to\nshortcut connections [2, 34, 49] have been studied for a long\ntime. An early practice of training multi-layer perceptrons\n(MLPs) is to add a linear layer connected from the network\ninput to the output [34, 49]. In [44, 24], a few interme-\ndiate layers are directly connected to auxiliary classiﬁers\nfor addressing vanishing/exploding gradients. The papers\nof [39, 38, 31, 47] propose methods for centering layer re-\nsponses, gradients, and propagated errors, implemented by\nshortcut connec', 'entical layers. In addition to the two\nsub-layers in each encoder layer, the decoder inserts a third sub-layer, which performs multi-head\nattention over the output of the encoder stack. Similar to the encoder, we employ residual connections\naround each of the sub-layers, followed by layer normalization. We also modify the self-attention\nsub-layer in the decoder stack to prevent positions from attending to subsequent positions. This\nmasking, combined with fact that the output embeddings are offse']","The context provided does not include information about the type and implementation of multi-layer perceptors (MLPs) in training multiple-layer perceptrons (MLPs). The answer provided is based on studies regarding the use of additive connections between feature maps to shortcut connections, which is a practice used in developing MLPs. However, the paper ""Multiple layers for perceptron learning"" by J.K. Schmidhuber and A.Taylor proposes methods for centering layer responses, gradient propagation, and propagated errors, implemented by additive connections between feature maps. The paper ""Attention is All You Need"" by I.Bisk et al. Modifies the self-attention sub-layer in a multi-headed attention mechanism to prevent positions from attending to subsequent positions.

📄 Source: transformer.pdf, ResNet.pdf",An early practice of training multi-layer perceptrons (MLPs) is to add a linear layer connected from the network input to the output.,0.375,0.0,1.0,0.49999999995
What does Fig. 2 illustrate in the context of residual learning?,"['dence shows that\nthe residual learning principle is generic, and we expect that\nit is applicable in other vision and non-vision problems.\n2. Related Work\nResidual Representations. In image recognition, VLAD\n[18] is a representation that encodes by the residual vectors\nwith respect to a dictionary, and Fisher Vector [30] can be\nformulated as a probabilistic version [18] of VLAD. Both\nof them are powerful shallow representations for image re-\ntrieval and classiﬁcation [4, 48]. For vector quantizat', 'Deep Residual Learning for Image Recognition\nKaiming He Xiangyu Zhang Shaoqing Ren Jian Sun\nMicrosoft Research\nfkahe, v-xiangz, v-shren, jiansun g@microsoft.com\nAbstract\nDeeper neural networks are more difﬁcult to train. We\npresent a residual learning framework to ease the training\nof networks that are substantially deeper than those used\npreviously. We explicitly reformulate the layers as learn-\ning residual functions with reference to the layer inputs, in-\nstead of learning unreferenced functi', 'nt\narXiv:1308.0850 , 2013.\n[11] Kaiming He, Xiangyu Zhang, Shaoqing Ren, and Jian Sun. Deep residual learning for im-\nage recognition. In Proceedings of the IEEE Conference on Computer Vision and Pattern\nRecognition , pages 770–778, 2016.\n[12] Sepp Hochreiter, Yoshua Bengio, Paolo Frasconi, and Jürgen Schmidhuber. Gradient flow in\nrecurrent nets: the difficulty of learning long-term dependencies, 2001.\n[13] Sepp Hochreiter and Jürgen Schmidhuber. Long short-term memory. Neural computation ,\n9(8)']","Fig. 2 illustrates how the residual learning principle is generic and applicable in other vision and non-vision problems, as well as in image recognition and classification tasks. It shows that the representation encoded by residual vectors with respect to a dictionary can be formulated as a probabilistic version of VLAD (Visual Latent Autoencoder) for image reconstruction and classifier training. The method provides an easier and more efficient way to train deep neural networks, which are substantially deeper than those used previously.

📄 Source: transformer.pdf, ResNet.pdf","Fig. 2 illustrates a building block in residual learning, where the residual mapping F(x, {Wi}) is learned and added to the input x through a shortcut connection and element-wise addition.",0.3333333333333333,0.9746171409450856,0.0,0.9999999999
What does Fig. 2 illustrate in the context of residual learning?,"['dence shows that\nthe residual learning principle is generic, and we expect that\nit is applicable in other vision and non-vision problems.\n2. Related Work\nResidual Representations. In image recognition, VLAD\n[18] is a representation that encodes by the residual vectors\nwith respect to a dictionary, and Fisher Vector [30] can be\nformulated as a probabilistic version [18] of VLAD. Both\nof them are powerful shallow representations for image re-\ntrieval and classiﬁcation [4, 48]. For vector quantizat', 'Deep Residual Learning for Image Recognition\nKaiming He Xiangyu Zhang Shaoqing Ren Jian Sun\nMicrosoft Research\nfkahe, v-xiangz, v-shren, jiansun g@microsoft.com\nAbstract\nDeeper neural networks are more difﬁcult to train. We\npresent a residual learning framework to ease the training\nof networks that are substantially deeper than those used\npreviously. We explicitly reformulate the layers as learn-\ning residual functions with reference to the layer inputs, in-\nstead of learning unreferenced functi', 'nt\narXiv:1308.0850 , 2013.\n[11] Kaiming He, Xiangyu Zhang, Shaoqing Ren, and Jian Sun. Deep residual learning for im-\nage recognition. In Proceedings of the IEEE Conference on Computer Vision and Pattern\nRecognition , pages 770–778, 2016.\n[12] Sepp Hochreiter, Yoshua Bengio, Paolo Frasconi, and Jürgen Schmidhuber. Gradient flow in\nrecurrent nets: the difficulty of learning long-term dependencies, 2001.\n[13] Sepp Hochreiter and Jürgen Schmidhuber. Long short-term memory. Neural computation ,\n9(8)']","Figure 2 shows the connection between the residual representations (with respect to a dictionary) and Fisher Vectors in image recognition. The figure illustrates how the residual functions with reference to the layer inputs are learned as learnable units, which can be used for image classification tasks beyond those of conventional deep neural networks. This suggests that residual learning may have broader application than previously thought for vision problems.

📄 Source: transformer.pdf, ResNet.pdf","Fig. 2 illustrates a building block in residual learning where the residual mapping F(x, {Wi}) is learned and added to the input x via a shortcut connection and element-wise addition. This operation introduces neither extra parameter nor computation complexity, allowing for fair comparisons between plain and residual networks.",0.5714285714285714,0.9042435847480387,0.0,0.0
