user_input,retrieved_contexts,response,reference,faithfulness,answer_relevancy,context_recall,context_precision
What datasets are used for training in the PASCAL VOC 2007 test set?,"['me linear activations with constant offsets and\nscales, and BN statistics are not updated by ﬁne-tuning. We\nﬁx the BN layers mainly for reducing memory consumption\nin Faster R-CNN training.\nPASCAL VOC\nFollowing [7, 32], for the PASCAL VOC 2007 testset,\nwe use the 5k trainval images in VOC 2007 and 16k train-\nvalimages in VOC 2012 for training (“07+12”). For the\nPASCAL VOC 2012 testset, we use the 10k trainval +test\nimages in VOC 2007 and 16k trainval images in VOC 2012\nfor training (“07++12”). T', 'ained on the standard WMT 2014 English-German dataset consisting of about 4.5 million\nsentence pairs. Sentences were encoded using byte-pair encoding [ 3], which has a shared source-\ntarget vocabulary of about 37000 tokens. For English-French, we used the significantly larger WMT\n2014 English-French dataset consisting of 36M sentences and split tokens into a 32000 word-piece\nvocabulary [ 38]. Sentence pairs were batched together by approximate sequence length. Each training\nbatch contained a set', '1 76.4 73.8\nTable 7. Object detection mAP (%) on the PASCAL VOC\n2007/2012 test sets using baseline Faster R-CNN. See also Ta-\nble 10 and 11 for better results.\nmetric mAP@.5 mAP@[.5, .95]\nVGG-16 41.5 21.2\nResNet-101 48.4 27.2\nTable 8. Object detection mAP (%) on the COCO validation set\nusing baseline Faster R-CNN. See also Table 9 for better results.\nhave similar training error. We argue that this is because of\noverﬁtting. The 1202-layer network may be unnecessarily\nlarge (19.4M) for this small ']","Context:
me linear activations with constant offsets and
scales, and BN statistics are not updated by fine-tuining. We fix the BN layers mainly for reducing memory consumption in Fastest R-CNN training. PASSCAL VOC 2007 testset, we use the 5k trainval + test images in VOC 2007 and 16k trainval images in VOC 2012 for training (“07++12”).

📄 Source: transformer.pdf, ResNet.pdf","For the PASCAL VOC 2007 test set, the training uses the 5k trainval images in VOC 2007 and 16k trainval images in VOC 2012 ('07+12').",0.5714285714285714,0.0,1.0,0.9999999999
What PASCAL VOC used for in object detection?,"['et Detection\nThe ImageNet Detection (DET) task involves 200 object\ncategories. The accuracy is evaluated by mAP@.5. Our\nobject detection algorithm for ImageNet DET is the same\nas that for MS COCO in Table 9. The networks are pre-\ntrained on the 1000-class ImageNet classiﬁcation set, and\nare ﬁne-tuned on the DET data. We split the validation set\ninto two parts (val1/val2) following [8]. We ﬁne-tune the\ndetection models using the DET training set and the val1\nset. The val2 set is used for validati', 's, which we will study in the future.\n4.3. Object Detection on PASCAL and MS COCO\nOur method has good generalization performance on\nother recognition tasks. Table 7 and 8 show the object de-\ntection baseline results on PASCAL VOC 2007 and 2012\n[5] and COCO [26]. We adopt Faster R-CNN [32] as the de-\ntection method. Here we are interested in the improvements\nof replacing VGG-16 [41] with ResNet-101. The detection\nimplementation (see appendix) of using both models is the\nsame, so the gains can onl', 'An open and portable library\nof computer vision algorithms, 2008.\n[49] W. Venables and B. Ripley. Modern applied statistics with s-plus.\n1999.\n[50] M. D. Zeiler and R. Fergus. Visualizing and understanding convolu-\ntional neural networks. In ECCV , 2014.\n9\nA. Object Detection Baselines\nIn this section we introduce our detection method based\non the baseline Faster R-CNN [32] system. The models are\ninitialized by the ImageNet classiﬁcation models, and then\nﬁne-tuned on the object detection data. W']","The provided context mentions that the object detection method is applied to other recognition tasks such as COCO and PASCAL, specifically on PASSCAL (VOC 2007 and 2012). Therefore, the question is not present in the given text.

📄 Source: ResNet.pdf","PASCAL VOC is used for training and testing object detection models. For the PASCAL VOC 2007 test set, 5k trainval images from VOC 2007 and 16k trainval images from VOC 2012 are used for training. For the PASCAL VOC 2012 test set, 10k trainval+test images from VOC 2007 and 16k trainval images from VOC 2012 are used for training.",1.0,0.0,0.3333333333333333,0.49999999995
How did the ResNet architecture contribute to winning the 1st places in ILSVRC & COCO 2015 competitions despite the challenges of optimizing deep networks?,"['sing both models is the\nsame, so the gains can only be attributed to better networks.\nMost remarkably, on the challenging COCO dataset we ob-\ntain a 6.0% increase in COCO’s standard metric (mAP@[.5,\n.95]), which is a 28% relative improvement. This gain is\nsolely due to the learned representations.\nBased on deep residual nets, we won the 1st places in\nseveral tracks in ILSVRC & COCO 2015 competitions: Im-\nageNet detection, ImageNet localization, COCO detection,\nand COCO segmentation. The details ', 'r on the test set (Table 5).\nThis entry won the 1st place in ILSVRC 2015.\n4.2. CIFAR-10 and Analysis\nWe conducted more studies on the CIFAR-10 dataset\n[20], which consists of 50k training images and 10k test-\ning images in 10 classes. We present experiments trained\non the training set and evaluated on the test set. Our focus\nis on the behaviors of extremely deep networks, but not on\npushing the state-of-the-art results, so we intentionally use\nsimple architectures as follows.\nThe plain/residual ', 'This result won the 1st place on the\nILSVRC 2015 classiﬁcation task. We also present analysis\non CIFAR-10 with 100 and 1000 layers.\nThe depth of representations is of central importance\nfor many visual recognition tasks. Solely due to our ex-\ntremely deep representations, we obtain a 28% relative im-\nprovement on the COCO object detection dataset. Deep\nresidual nets are foundations of our submissions to ILSVRC\n& COCO 2015 competitions1, where we also won the 1st\nplaces on the tasks of ImageNet d']","The ResNet architecture, as described in the context provided, contributed to winning the 1st places in ILSVRC & COCO 2015 competition by only having a 6.0% increase in COCO's standard metric (mAP@[.5, .95]) and being solely due to the learned representations. While deep residual net architecture is not mentioned explicitly in the context provided, this is consistent with prior research that suggests these types of networks can improve performance on complex tasks like object detection and image recognition, given sufficient training data and attention to details such as optimizing deep networks for large convolutional neural networks (CNNs) rather than single-layer architectures.

📄 Source: ResNet.pdf","The ResNet architecture contributed to winning the 1st places in ILSVRC & COCO 2015 competitions by providing improved learned representations that enhanced visual recognition performance. Despite the challenges of optimizing deep networks, ResNet's design, which includes residual functions that are generally closer to zero than non-residual functions, allowed for deeper models without optimization difficulties. This architecture demonstrated good generalization performance on recognition tasks, as evidenced by the significant improvements in object detection metrics on datasets like PASCAL VOC and COCO. Specifically, replacing VGG-16 with ResNet-101 resulted in a 6.0% increase in COCO's standard metric (mAP@[.5, .95]), a 28% relative improvement, solely due to the learned representations. These advancements were crucial in achieving top positions in the competitions.",0.3,0.9618215749877438,0.4,0.8333333332916666
How did ResNet models contribute to winning the ILSVRC 2015 competition in both classification and localization tasks?,"['). This result won the 1st place\nin the ImageNet detection task in ILSVRC 2015 , surpassing\nthe second place by 8.5 points (absolute).\nC. ImageNet Localization\nThe ImageNet Localization (LOC) task [36] requires to\nclassify and localize the objects. Following [40, 41], we\nassume that the image-level classiﬁers are ﬁrst adopted for\npredicting the class labels of an image, and the localiza-\ntion algorithm only accounts for predicting bounding boxes\nbased on the predicted classes. We adopt the “per-', 'sing both models is the\nsame, so the gains can only be attributed to better networks.\nMost remarkably, on the challenging COCO dataset we ob-\ntain a 6.0% increase in COCO’s standard metric (mAP@[.5,\n.95]), which is a 28% relative improvement. This gain is\nsolely due to the learned representations.\nBased on deep residual nets, we won the 1st places in\nseveral tracks in ILSVRC & COCO 2015 competitions: Im-\nageNet detection, ImageNet localization, COCO detection,\nand COCO segmentation. The details ', 'ished models and ensembles, at a fraction of the training cost of any of\nthe competitive models.\nOn the WMT 2014 English-to-French translation task, our big model achieves a BLEU score of 41.0,\noutperforming all of the previously published single models, at less than 1/4the training cost of the\nprevious state-of-the-art model. The Transformer (big) model trained for English-to-French used\ndropout rate Pdrop= 0.1, instead of 0.3.\nFor the base models, we used a single model obtained by averaging t']","ResNet models played a significant role in winning the ImageNet detection and localization tasks at the 2015 International Conference on Image and Signal Processing (ICISS) with the help of their learned representations. The models were trained to predict the class labels of an image based on the predicted classes, but they also used these predictions to predict bounding boxes based on the predicted classes. This allowed them to significantly outperform the competition at both detection and localization tasks. The ImageNet Localization task required the prediction of object positions in a 3D environment, while the COCO detection and localization tasks required only class label predictions. By using learned representations for both classification and localization, ResNet models were able to achieve a combined improvement of 28% in the COCO validation dataset's standard metric (mAP@[.5, .95]), which is a significant contribution to both detection and localization tasks.

📄 Source: transformer.pdf, ResNet.pdf","ResNet models played a significant role in winning the ILSVRC 2015 competition by achieving outstanding results in both classification and localization tasks. In the classification task, the 152-layer ResNet achieved a single-model top-5 validation error of 4.49%, outperforming all previous ensemble results, and when combined into an ensemble, it led to a 3.57% top-5 error on the test set, securing 1st place. In the localization task, the ResNet-101 model significantly reduced the center-crop error to 13.3% using ground truth classes, and further improved to 11.7% with dense and multi-scale testing, demonstrating excellent performance and surpassing previous state-of-the-art methods.",0.5555555555555556,0.9363863688681064,0.3333333333333333,0.99999999995
How does the Faster R-CNN detection method initialized with ResNet-101 improve object detection performance in the ILSVRC context compared to previous models like VGG-16?,"['s, which we will study in the future.\n4.3. Object Detection on PASCAL and MS COCO\nOur method has good generalization performance on\nother recognition tasks. Table 7 and 8 show the object de-\ntection baseline results on PASCAL VOC 2007 and 2012\n[5] and COCO [26]. We adopt Faster R-CNN [32] as the de-\ntection method. Here we are interested in the improvements\nof replacing VGG-16 [41] with ResNet-101. The detection\nimplementation (see appendix) of using both models is the\nsame, so the gains can onl', 'et Detection\nThe ImageNet Detection (DET) task involves 200 object\ncategories. The accuracy is evaluated by mAP@.5. Our\nobject detection algorithm for ImageNet DET is the same\nas that for MS COCO in Table 9. The networks are pre-\ntrained on the 1000-class ImageNet classiﬁcation set, and\nare ﬁne-tuned on the DET data. We split the validation set\ninto two parts (val1/val2) following [8]. We ﬁne-tune the\ndetection models using the DET training set and the val1\nset. The val2 set is used for validati', 'An open and portable library\nof computer vision algorithms, 2008.\n[49] W. Venables and B. Ripley. Modern applied statistics with s-plus.\n1999.\n[50] M. D. Zeiler and R. Fergus. Visualizing and understanding convolu-\ntional neural networks. In ECCV , 2014.\n9\nA. Object Detection Baselines\nIn this section we introduce our detection method based\non the baseline Faster R-CNN [32] system. The models are\ninitialized by the ImageNet classiﬁcation models, and then\nﬁne-tuned on the object detection data. W']","The Faster R-CNN detection method initialized with ResNet-101 improves object detection performance in the ILSVRC context compared to previous models like VGG-16. This is because the ResNet-101 model has better features than the VGG-16 model, which have been found to be superior for image classification tasks. The ResNet-101 model is also pre-trained on a larger dataset, which improves its generalization performance in unseen datasets like ILSVRC. By fine-tuning the detection model using the ILSVRC object detection data, the Faster R-CNN method has significantly improved object detection results compared to previous models like VGG-16.

📄 Source: ResNet.pdf","The Faster R-CNN detection method initialized with ResNet-101 improves object detection performance in the ILSVRC context by using a deeper network without hidden fully connected layers, unlike VGG-16. ResNet-101 computes full-image shared convolutional feature maps up to conv4_x, which are analogous to the 13 convolutional layers in VGG-16, maintaining the same total stride of 16 pixels. These layers are shared by both the region proposal network (RPN) and the Fast R-CNN detection network. RoI pooling is performed before conv5_1, with conv5_x layers applied on the RoI-pooled features, taking the role of VGG-16’s fully connected layers. Batch Normalization (BN) layers are fixed after pre-training on ImageNet to reduce memory consumption during fine-tuning. This architecture and feature sharing allow ResNet-101 to improve mean Average Precision (mAP) by over 3% compared to VGG-16, demonstrating enhanced feature learning and overall detection accuracy in the ILSVRC and COCO competitions.",0.0,0.9508153385558841,0.3333333333333333,0.9999999999
"how much dos the mAP on COCO val improove when using ResNet-101 with box refinemment, global context, and multi-scale testing compared to the baseline Faster R-CNN (VGG-16), and wut does this say about the effekt of these techniks on COCO val performence?","[' base model\nin different ways, measuring the change in performance on English-to-German translation on the\n5We used values of 2.8, 3.7, 6.0 and 9.5 TFLOPS for K80, K40, M40 and P100, respectively.\n8\nTable 3: Variations on the Transformer architecture. Unlisted values are identical to those of the base\nmodel. All metrics are on the English-to-German translation development set, newstest2013. Listed\nperplexities are per-wordpiece, according to our byte-pair encoding, and should not be compared to\n', '+++ ResNet-101 COCO+07++12 83.8 92.1 88.4 84.8 75.9 71.4 86.3 87.8 94.2 66.8 89.4 69.2 93.9 91.9 90.9 89.6 67.9 88.2 76.8 90.3 80.0\nTable 11. Detection results on the PASCAL VOC 2012 test set ( http://host.robots.ox.ac.uk:8080/leaderboard/\ndisplaylb.php?challengeid=11&compid=4 ). The baseline is the Faster R-CNN system. The system “baseline+++” include\nbox reﬁnement, context, and multi-scale testing in Table 9.\nWe select two adjacent scales from the pyramid following\n[33]. RoI pooling and subseq', 'f 0.001 and then for 80k iterations with 0.0001.\nTable 8 shows the results on the MS COCO validation\nset. ResNet-101 has a 6% increase of mAP@[.5, .95] over\nVGG-16, which is a 28% relative improvement, solely con-\ntributed by the features learned by the better network. Re-\nmarkably, the mAP@[.5, .95]’s absolute increase (6.0%) is\nnearly as big as mAP@.5’s (6.9%). This suggests that a\ndeeper network can improve both recognition and localiza-\ntion.\nB. Object Detection Improvements\nFor completeness']","Based on context provided, the given material answers the question ""How much do the mAP on COCO val improvements when using ResNet-101 with box refinemment, global context, and multi-scale testing compared to the base line Faster R-CNN (VGG-16) and what does this say about the effectiveness of these techniques on COCO val performance?"" by stating that the improved mAP@[.5, .95] on the MS COCO validation set when using ResNet-101 with box refinemment, global context, and multi-scale testing is equivalent to a 28% improvement compared to VGG-16. This suggests that these techniques are effective in improving object detection performance.

📄 Source: ResNet.pdf, transformer.pdf","On COCO val, the baseline Faster R-CNN with VGG-16 achieves an mAP@.5 of 41.5 and an mAP@[.5, .95] of 21.2. When switching to ResNet-101 and progressively adding box refinement, global context, and multi-scale testing, the performance on COCO val improves as follows:

- Baseline Faster R-CNN (ResNet-101): mAP@.5 = 48.4, mAP@[.5, .95] = 27.2
- + box refinement: mAP@.5 = 49.9, mAP@[.5, .95] = 29.9
- + context: mAP@.5 = 51.1, mAP@[.5, .95] = 30.0
- + multi-scale testing: mAP@.5 = 53.8, mAP@[.5, .95] = 32.5

Comparing the final configuration (ResNet-101 with box refinement, global context, and multi-scale testing) to the original VGG-16 baseline on COCO val, the mAP@.5 increases from 41.5 to 53.8 (a gain of 12.3 points), and the mAP@[.5, .95] increases from 21.2 to 32.5 (a gain of 11.3 points). These results indicate that using a deeper network (ResNet-101) together with box refinement, global context, and multi-scale testing substantially improves COCO val performance, enhancing both recognition and localization quality as reflected in the higher mAP@[.5, .95].",0.5,0.9679032278510461,0.25,0.9999999999666667
How did the use of ResNet-101 contribute to winning the ILSVRC 2015 detection and localization tasks?,"['). This result won the 1st place\nin the ImageNet detection task in ILSVRC 2015 , surpassing\nthe second place by 8.5 points (absolute).\nC. ImageNet Localization\nThe ImageNet Localization (LOC) task [36] requires to\nclassify and localize the objects. Following [40, 41], we\nassume that the image-level classiﬁers are ﬁrst adopted for\npredicting the class labels of an image, and the localiza-\ntion algorithm only accounts for predicting bounding boxes\nbased on the predicted classes. We adopt the “per-', '101 has an error\nof 11.7% using ground truth classes. Using ResNet-101 for\npredicting classes (4.6% top-5 classiﬁcation error, Table 4),\nthe top-5 localization error is 14.4%.\nThe above results are only based on the proposal network\n(RPN) in Faster R-CNN [32]. One may use the detection\nnetwork (Fast R-CNN [7]) in Faster R-CNN to improve the\nresults. But we notice that on this dataset, one image usually\ncontains a single dominate object, and the proposal regions\nhighly overlap with each other and', ' Using an ensemble of networks for both clas-\nsiﬁcation and localization, we achieve a top-5 localization\nerror of 9.0% on the test set. This number signiﬁcantly out-\nperforms the ILSVRC 14 results (Table 14), showing a 64%\nrelative reduction of error. This result won the 1st place in\nthe ImageNet localization task in ILSVRC 2015.\n12\n']","The answer is that the use of ResNet-101 for predicting classes helped in improving the results on the ImageNet detection and localization tasks. The ImageNet Localization (LOC) task requires to classify and localize the objects, and ResNet-101 was adopted by the authors for predicting classes based on predicted classes. The authors noted that using ResNet-101 instead of a traditional convolutional network with fixed classification heads improved the top-5 localization error from 11.7% to 9.0%, which significantly outperforms the ILSVRC 2014 results (Table 14). This result won the first place in the ImageNet detection and localization tasks in ILSVRC 2015, indicating its effectiveness in improving the performance of AI systems in image classification.

📄 Source: ResNet.pdf","The use of ResNet-101 significantly contributed to winning the ILSVRC 2015 detection and localization tasks by reducing localization errors and improving detection performance. In the ImageNet Localization task, ResNet-101 reduced the center-crop error to 13.3% and further to 11.7% with dense and multi-scale testing, demonstrating excellent performance compared to previous methods. Additionally, the ensemble of models using ResNet-101 achieved 62.1% mAP on the DET test set, surpassing the second place by 8.5 points. The deep residual learning framework, which allows for training networks substantially deeper than those used previously, was crucial in achieving these results, as it eased the optimization of deep networks and improved accuracy through increased depth.",0.2857142857142857,0.9381638384177594,0.0,0.9999999999666667
"How does the ResNet architecture address the degradation problem observed in deeper plain networks during ImageNet classification, specifically when comparing 18-layer and 34-layer models?","['nt (SGD) with back-\npropagation [22].\nWhen deeper networks are able to start converging, a\ndegradation problem has been exposed: with the network\ndepth increasing, accuracy gets saturated (which might be\nunsurprising) and then degrades rapidly. Unexpectedly,\nsuch degradation is not caused by overﬁtting , and adding\nmore layers to a suitably deep model leads to higher train-\ning error , as reported in [11, 42] and thoroughly veriﬁed by\nour experiments. Fig. 1 shows a typical example.\nThe degradat', 'layer ResNet exhibits\nconsiderably lower training error and is generalizable to the\nvalidation data. This indicates that the degradation problem\nis well addressed in this setting and we manage to obtain\naccuracy gains from increased depth.\nSecond, compared to its plain counterpart, the 34-layer\n3We have experimented with more training iterations (3 \x02) and still ob-\nserved the degradation problem, suggesting that this problem cannot be\nfeasibly addressed by simply using more iterations.\n5\nmodel t', 'ote that the degradation problem\nof plain nets is also witnessed for the bottleneck designs.\n6\n34-layer net with this 3-layer bottleneck block, resulting in\na 50-layer ResNet (Table 1). We use option B for increasing\ndimensions. This model has 3.8 billion FLOPs.\n101-layer and 152-layer ResNets: We construct 101-\nlayer and 152-layer ResNets by using more 3-layer blocks\n(Table 1). Remarkably, although the depth is signiﬁcantly\nincreased, the 152-layer ResNet (11.3 billion FLOPs) still\nhaslower com']","Based on the provided context, the question is about how a ResNet architecture addresses the degradation problem observed when deepening deeper networks. The answer is that it does not address the degradation problem per se, but rather solves the specific problem of increased depth resulting in lower training error and improved generalization accuracy. Specifically, the 101-layer and 152-layer ResNet models with more 3-layer blocks, despite having a higher number of layers, still have lower training errors and better generalization accuracy than their plain counterparts when compared to 18-layer ResNets (which uses the same bottleneck design). Therefore, this is not a problem that can be addressed by simply increasing the depth.

📄 Source: ResNet.pdf","The ResNet architecture addresses the degradation problem seen in deeper plain networks by incorporating residual learning, which allows training of very deep networks without increasing training error. In the ImageNet classification experiments, the 34-layer plain network exhibited higher training and validation errors compared to the shallower 18-layer plain network, indicating degradation. However, ResNet-34 outperformed its plain 34-layer counterpart by achieving lower top-1 validation error (25.03% vs. 28.54%) without increasing model parameters. Training curves show that while the 34-layer plain net had consistently higher training error, the 34-layer ResNet maintained lower training and validation errors, demonstrating that residual connections effectively mitigate the degradation problem in deeper networks.",0.7777777777777778,0.0,0.5,0.9999999999666667
