user_input,retrieved_contexts,response,reference,faithfulness,answer_relevancy,context_recall,context_precision
"What P E(pos,2i) do?","['2: (left) Scaled Dot-Product Attention. (right) Multi-Head Attention consists of several\nattention layers running in parallel.\nof the values, where the weight assigned to each value is computed by a compatibility function of the\nquery with the corresponding key.\n3.2.1 Scaled Dot-Product Attention\nWe call our particular attention ""Scaled Dot-Product Attention"" (Figure 2). The input consists of\nqueries and keys of dimension dk, and values of dimension dv. We compute the dot products of the\nquery w', 'el)\nPE(pos,2i+1)=cos(pos/100002i/d model)\nwhere posis the position and iis the dimension. That is, each dimension of the positional encoding\ncorresponds to a sinusoid. The wavelengths form a geometric progression from 2πto10000 ·2π. We\nchose this function because we hypothesized it would allow the model to easily learn to attend by\nrelative positions, since for any fixed offset k,PEpos+kcan be represented as a linear function of\nPEpos.\nWe also experimented with using learned positional embedding', 'r absolute position of the\ntokens in the sequence. To this end, we add ""positional encodings"" to the input embeddings at the\nbottoms of the encoder and decoder stacks. The positional encodings have the same dimension dmodel\nas the embeddings, so that the two can be summed. There are many choices of positional encodings,\nlearned and fixed [9].\nIn this work, we use sine and cosine functions of different frequencies:\nPE(pos,2i)=sin(pos/100002i/d model)\nPE(pos,2i+1)=cos(pos/100002i/d model)\nwhere po']","The provided context doesn't mention the specifics of how the P E(pos,2i) are computed in the Scaled Doot-Product Attention. However, based on the available information, we can infer that these functions are used to create a more complex and multi-dimensional attention mechanism by encoding the positional information of the inputs into the outputs of the attention network. The exact implementation or details may vary depending on the specific architecture of the AI assistant being referred to.

📄 Source: transformer.pdf","P E(pos,2i) is part of the positional encoding using sine functions of different frequencies, where pos is the position and i is the dimension. It helps the model learn to attend by relative positions and may allow extrapolation to longer sequence lengths.",0.5,0.0,0.5,0.5833333333041666
What role does 'pos' play in positional encodings?,"['r absolute position of the\ntokens in the sequence. To this end, we add ""positional encodings"" to the input embeddings at the\nbottoms of the encoder and decoder stacks. The positional encodings have the same dimension dmodel\nas the embeddings, so that the two can be summed. There are many choices of positional encodings,\nlearned and fixed [9].\nIn this work, we use sine and cosine functions of different frequencies:\nPE(pos,2i)=sin(pos/100002i/d model)\nPE(pos,2i+1)=cos(pos/100002i/d model)\nwhere po', 'el)\nPE(pos,2i+1)=cos(pos/100002i/d model)\nwhere posis the position and iis the dimension. That is, each dimension of the positional encoding\ncorresponds to a sinusoid. The wavelengths form a geometric progression from 2πto10000 ·2π. We\nchose this function because we hypothesized it would allow the model to easily learn to attend by\nrelative positions, since for any fixed offset k,PEpos+kcan be represented as a linear function of\nPEpos.\nWe also experimented with using learned positional embedding', 'o attend to\nall positions in the decoder up to and including that position. We need to prevent leftward\ninformation flow in the decoder to preserve the auto-regressive property. We implement this\ninside of scaled dot-product attention by masking out (setting to −∞) all values in the input\nof the softmax which correspond to illegal connections. See Figure 2.\n3.3 Position-wise Feed-Forward Networks\nIn addition to attention sub-layers, each of the layers in our encoder and decoder contains a fully\n']","Sure! In the context of the paper, the role of ""pos"" in the positional encoding functions is not explicitly mentioned. However, it can be inferred from the given context that PE(pos,2i) and PE(pos,2i+1) correspond to sinusoids with frequencies 2pi/d_model and 2pi/(d_model * d_model), respectively, so they can be seen as sinosoidal wavelets. This is consistent with the choice of function used in this work for positional encoding.

📄 Source: transformer.pdf","In positional encodings, 'pos' represents the position, and it is used in the sine and cosine functions to determine the value of each dimension of the encoding.",0.6,0.0,1.0,0.99999999995
"why P E(pos,2i) use sine and cosine functions of different frequencies for positional encoding in deep learning model?","['r absolute position of the\ntokens in the sequence. To this end, we add ""positional encodings"" to the input embeddings at the\nbottoms of the encoder and decoder stacks. The positional encodings have the same dimension dmodel\nas the embeddings, so that the two can be summed. There are many choices of positional encodings,\nlearned and fixed [9].\nIn this work, we use sine and cosine functions of different frequencies:\nPE(pos,2i)=sin(pos/100002i/d model)\nPE(pos,2i+1)=cos(pos/100002i/d model)\nwhere po', 'el)\nPE(pos,2i+1)=cos(pos/100002i/d model)\nwhere posis the position and iis the dimension. That is, each dimension of the positional encoding\ncorresponds to a sinusoid. The wavelengths form a geometric progression from 2πto10000 ·2π. We\nchose this function because we hypothesized it would allow the model to easily learn to attend by\nrelative positions, since for any fixed offset k,PEpos+kcan be represented as a linear function of\nPEpos.\nWe also experimented with using learned positional embedding', 'perimented with using learned positional embeddings [ 9] instead, and found that the two\nversions produced nearly identical results (see Table 3 row (E)). We chose the sinusoidal version\nbecause it may allow the model to extrapolate to sequence lengths longer than the ones encountered\nduring training.\n4 Why Self-Attention\nIn this section we compare various aspects of self-attention layers to the recurrent and convolu-\ntional layers commonly used for mapping one variable-length sequence of symbol']","In this work, the authors use sinne and cosine functions of different frequencies (PE(pos,2i)) as positional encoding in their deep learning model to capture dependencies between symbols in a sequence. The authors hypothesize that these functions allow for easier learning to attend by relative positions since they form a geometric progression from 2πto10000·2π. The authors experimented with learning positional embedding instead, but found that the two versions produced nearly identical results. The authors chose the sinse function because it may allow the model to extrapolate to sequence lengths longer than those encountered during training.

📄 Source: transformer.pdf","P E(pos,2i) uses sine and cosine functions of different frequencies for positional encoding because this choice allows the model to easily learn to attend by relative positions. Each dimension corresponds to a sinusoid with wavelengths forming a geometric progression from 2π to 10000 · 2π, enabling the representation of a fixed offset k as a linear function of P Epos. This sinusoidal version also may allow the model to extrapolate to sequence lengths longer than those encountered during training, compared to learned positional embeddings which produced nearly identical results.",0.875,0.8378803001007359,1.0,0.9999999999666667
What Table 1 say about self-attention layer and recurrent layer?,"['sier it is to learn long-range dependencies [ 12]. Hence we also compare\nthe maximum path length between any two input and output positions in networks composed of the\ndifferent layer types.\nAs noted in Table 1, a self-attention layer connects all positions with a constant number of sequentially\nexecuted operations, whereas a recurrent layer requires O(n)sequential operations. In terms of\ncomputational complexity, self-attention layers are faster than recurrent layers when the sequence\n6\nlength ', 'r attention mechanisms in sequence-to-sequence models such as\n[38, 2, 9].\n•The encoder contains self-attention layers. In a self-attention layer all of the keys, values\nand queries come from the same place, in this case, the output of the previous layer in the\nencoder. Each position in the encoder can attend to all positions in the previous layer of the\nencoder.\n•Similarly, self-attention layers in the decoder allow each position in the decoder to attend to\nall positions in the decoder up to and', 'just\n-\nthis\nis\nwhat\nwe\nare\nmissing\n,\nin\nmy\nopinion\n.\n<EOS>\n<pad>Figure 5: Many of the attention heads exhibit behaviour that seems related to the structure of the\nsentence. We give two such examples above, from two different heads from the encoder self-attention\nat layer 5 of 6. The heads clearly learned to perform different tasks.\n15\n']","Based on the provided context, using ONLY the provided context in answering the question, the answer to the given question is as follows:

Question: What does Table 1 say about self-attention layer and recurrent layer?

Answer: The table mentions that a self-attenention layer connects all positions with a constant number of sequential operations when the sequence is long. However, self-attenition layers are faster than recurrent layers when the sequence length is relatively short, according to the given context in the question.

📄 Source: transformer.pdf","Table 1 notes that a self-attention layer connects all positions with a constant number of sequentially executed operations, whereas a recurrent layer requires O(n) sequential operations. In terms of computational complexity, self-attention layers are faster than recurrent layers when the sequence length n is smaller than the representation dimensionality d.",0.3333333333333333,0.9927080649750186,1.0,0.99999999995
Waht does Table 1 reveal about the computational complexity of self-attention layers compared to recurrent layers?,"['sier it is to learn long-range dependencies [ 12]. Hence we also compare\nthe maximum path length between any two input and output positions in networks composed of the\ndifferent layer types.\nAs noted in Table 1, a self-attention layer connects all positions with a constant number of sequentially\nexecuted operations, whereas a recurrent layer requires O(n)sequential operations. In terms of\ncomputational complexity, self-attention layers are faster than recurrent layers when the sequence\n6\nlength ', 'th of the longest paths\nbetween any two positions in the network. Convolutional layers are generally more expensive than\nrecurrent layers, by a factor of k. Separable convolutions [ 6], however, decrease the complexity\nconsiderably, to O(k·n·d+n·d2). Even with k=n, however, the complexity of a separable\nconvolution is equal to the combination of a self-attention layer and a point-wise feed-forward layer,\nthe approach we take in our model.\nAs side benefit, self-attention could yield more interpre', 'r attention mechanisms in sequence-to-sequence models such as\n[38, 2, 9].\n•The encoder contains self-attention layers. In a self-attention layer all of the keys, values\nand queries come from the same place, in this case, the output of the previous layer in the\nencoder. Each position in the encoder can attend to all positions in the previous layer of the\nencoder.\n•Similarly, self-attention layers in the decoder allow each position in the decoder to attend to\nall positions in the decoder up to and']","In Table 1, self-attenention layers (SAT) are faster than recurrent layers when it comes to the sequence length. This means that they have a higher computational complexity compared to recurrent layers, but their efficiency is proportional to the sequence length. Convolutional layers are also generally more expensive than recurrent layers, but with separable convolutions (see previous answer), their computation cost decreases significantly. Even with k=n, self-attenention could yield better performance in sequence-to-sequence models, such as language translation or text summarization, by attending to all possible positions in the output of one layer and using a more interpretable mechanism than recurrent layers. However, this benefit is not immediate and requires further research.

📄 Source: transformer.pdf","Table 1 indicates that a self-attention layer connects all positions with a constant number of sequentially executed operations, whereas a recurrent layer requires O(n) sequential operations. Self-attention layers are faster than recurrent layers when the sequence length n is smaller than the representation dimensionality d, which is often the case with sentence representations used by state-of-the-art models in machine translations.",0.3,0.0,0.5,0.99999999995
What does Table 1 indicate about the computational complexity of self-attention layers compared to recurrent layers?,"['sier it is to learn long-range dependencies [ 12]. Hence we also compare\nthe maximum path length between any two input and output positions in networks composed of the\ndifferent layer types.\nAs noted in Table 1, a self-attention layer connects all positions with a constant number of sequentially\nexecuted operations, whereas a recurrent layer requires O(n)sequential operations. In terms of\ncomputational complexity, self-attention layers are faster than recurrent layers when the sequence\n6\nlength ', 'th of the longest paths\nbetween any two positions in the network. Convolutional layers are generally more expensive than\nrecurrent layers, by a factor of k. Separable convolutions [ 6], however, decrease the complexity\nconsiderably, to O(k·n·d+n·d2). Even with k=n, however, the complexity of a separable\nconvolution is equal to the combination of a self-attention layer and a point-wise feed-forward layer,\nthe approach we take in our model.\nAs side benefit, self-attention could yield more interpre', 'r attention mechanisms in sequence-to-sequence models such as\n[38, 2, 9].\n•The encoder contains self-attention layers. In a self-attention layer all of the keys, values\nand queries come from the same place, in this case, the output of the previous layer in the\nencoder. Each position in the encoder can attend to all positions in the previous layer of the\nencoder.\n•Similarly, self-attention layers in the decoder allow each position in the decoder to attend to\nall positions in the decoder up to and']","Context:
Table 1 indicates that a self-attention layer requires O(n) sequential operations, whereas a recurrent layer requires O(n^2). In terms of computational complexity, self-attention layers are faster than recurrent layers when the sequence length is large or the network's input size is small.
In our AI assistant's interpretation, this indicates that self-attenition layers could potentially yield more interpretable and interpretable machine learning models compared to recurrent layers. By allowing each position in a sequence to attend to all positions up to and including the current position, self-attenion layers may be able to capture more contextually relevant information while maintaining efficiency.

📄 Source: transformer.pdf","Table 1 indicates that self-attention layers connect all positions with a constant number of sequentially executed operations, whereas recurrent layers require O(n) sequential operations. Self-attention layers are faster than recurrent layers when the sequence length n is smaller than the representation dimensionality d, which is often the case with sentence representations used by state-of-the-art models in machine translations.",0.2857142857142857,0.9266811868317872,0.5,0.99999999995
wht addam optmizer settingz did u use 4 training the transformer model?,"['the\nbottom line of table 3), step time was 1.0 seconds. The big models were trained for 300,000 steps\n(3.5 days).\n5.3 Optimizer\nWe used the Adam optimizer [ 20] with β1= 0.9,β2= 0.98andϵ= 10−9. We varied the learning\nrate over the course of training, according to the formula:\nlrate =d−0.5\nmodel·min(step_num−0.5, step _num·warmup _steps−1.5) (3)\nThis corresponds to increasing the learning rate linearly for the first warmup _steps training steps,\nand decreasing it thereafter proportionally to the ', 'e the 80k images on the train set for train-\ning and the 40k images on the val set for evaluation. Our\ndetection system for COCO is similar to that for PASCAL\nVOC. We train the COCO models with an 8-GPU imple-\nmentation, and thus the RPN step has a mini-batch size of8 images ( i.e., 1 per GPU) and the Fast R-CNN step has a\nmini-batch size of 16 images. The RPN step and Fast R-\nCNN step are both trained for 240k iterations with a learn-\ning rate of 0.001 and then for 80k iterations with 0.0001.\nT', '10, we run it 5 times\nand show “best (mean \x06std)” as in [43].\nso our residual models have exactly the same depth, width,\nand number of parameters as the plain counterparts.\nWe use a weight decay of 0.0001 and momentum of 0.9,\nand adopt the weight initialization in [13] and BN [16] but\nwith no dropout. These models are trained with a mini-\nbatch size of 128 on two GPUs. We start with a learning\nrate of 0.1, divide it by 10 at 32k and 48k iterations, and\nterminate training at 64k iterations, which']","Yes, we used the Adam optimizer with a learning rate of 0.1 for training our Transformer models on the COCO training set and the VOC validation set. This was the first time that this optimization method had been used for these tasks, and it has proven to be effective in improving the training performance. We also varied the learning rate over the course of training, according to the formula described in the given context.

📄 Source: ResNet.pdf, transformer.pdf","We used the Adam optimizer with β1 = 0.9, β2 = 0.98 and ϵ = 10−9. The learning rate was varied over the course of training according to the formula lrate = d−0.5_model · min(step_num−0.5, step_num · warmup_steps−1.5). This corresponds to increasing the learning rate linearly for the first warmup_steps training steps, and decreasing it thereafter proportionally to the inverse square root of the step number. We used warmup_steps = 4000.",0.25,0.8695341745490506,0.75,0.9999999999
How does the big transformer model perform on the English-to-German translation task compared to previous models?,"[' Results\n6.1 Machine Translation\nOn the WMT 2014 English-to-German translation task, the big transformer model (Transformer (big)\nin Table 2) outperforms the best previously reported models (including ensembles) by more than 2.0\nBLEU, establishing a new state-of-the-art BLEU score of 28.4. The configuration of this model is\nlisted in the bottom line of Table 3. Training took 3.5days on 8P100 GPUs. Even our base model\nsurpasses all previously published models and ensembles, at a fraction of the t', ' base model\nin different ways, measuring the change in performance on English-to-German translation on the\n5We used values of 2.8, 3.7, 6.0 and 9.5 TFLOPS for K80, K40, M40 and P100, respectively.\n8\nTable 3: Variations on the Transformer architecture. Unlisted values are identical to those of the base\nmodel. All metrics are on the English-to-German translation development set, newstest2013. Listed\nperplexities are per-wordpiece, according to our byte-pair encoding, and should not be compared to\n', 'based solely on attention mechanisms, dispensing with recurrence and convolutions\nentirely. Experiments on two machine translation tasks show these models to\nbe superior in quality while being more parallelizable and requiring significantly\nless time to train. Our model achieves 28.4 BLEU on the WMT 2014 English-\nto-German translation task, improving over the existing best results, including\nensembles, by over 2 BLEU. On the WMT 2014 English-to-French translation task,\nour model establishes a ne']","Based on the provided context, the answer to the question is ""the big transformer model (Transformer (big) in Table 2) outperforms the best previously reported models by more than 2.0 BLEU and establishes a new state-of-the-art BLEU score of 28.4 on the WMT 2014 English-to-German translation task.""

📄 Source: transformer.pdf","On the WMT 2014 English-to-German translation task, the big transformer model outperforms the best previously reported models, including ensembles, by more than 2.0 BLEU, establishing a new state-of-the-art BLEU score of 28.4.",1.0,0.9624025501518975,1.0,0.9999999999666667
What does Table 2 reveal about the performance of the Transformer model?,"[' base model\nin different ways, measuring the change in performance on English-to-German translation on the\n5We used values of 2.8, 3.7, 6.0 and 9.5 TFLOPS for K80, K40, M40 and P100, respectively.\n8\nTable 3: Variations on the Transformer architecture. Unlisted values are identical to those of the base\nmodel. All metrics are on the English-to-German translation development set, newstest2013. Listed\nperplexities are per-wordpiece, according to our byte-pair encoding, and should not be compared to\n', 'semble of 3 networks. The\nmAP is 59.0% and 37.4% on the test-dev set. This result\nwon the 1st place in the detection task in COCO 2015.\nPASCAL VOC\nWe revisit the PASCAL VOC dataset based on the above\nmodel. With the single model on the COCO dataset (55.7%\nmAP@.5 in Table 9), we ﬁne-tune this model on the PAS-\nCAL VOC sets. The improvements of box reﬁnement, con-\ntext, and multi-scale testing are also adopted. By doing soval2 test\nGoogLeNet [44] (ILSVRC’14) - 43.9\nour single model (ILSVRC’15) 60.', 'rizes our results and compares our translation quality and training costs to other model\narchitectures from the literature. We estimate the number of floating point operations used to train a\nmodel by multiplying the training time, the number of GPUs used, and an estimate of the sustained\nsingle-precision floating-point capacity of each GPU5.\n6.2 Model Variations\nTo evaluate the importance of different components of the Transformer, we varied our base model\nin different ways, measuring the chang']","Table 3 provides some variations on the Transformer architecture that were used to evaluate its performance. The listed perplexities are per-wordpiece according to our byte-pair encoding, and should not be compared to actual performance. The results won the 1st place in the detection task in COCO 2015 and revised the PASSCAL VOC dataset based on the above base model with single model on COCO dataset (55.7% mAP@.5). The improvements of box reﬁnement, con-text, and multi-scale testing were also adopted. Overall, our single model has a better translation quality and training costs compared to other model architecture from the literature, as estimated by multiplying training time, number of GPUs used, and an estimate of sustained single-precision floating-point capacity of each GPU.

📄 Source: ResNet.pdf, transformer.pdf",Table 2 shows that the Transformer model achieves better BLEU scores than previous state-of-the-art models on the English-to-German and English-to-French newstest2014 tests at a fraction of the training cost.,0.7777777777777778,0.8824983783376056,0.0,0.0
